{
  "company": "NVIDIA Corporation",
  "ticker": "NVDA",
  "reporting_period": "2023",
  "currency": "USD",
  "schema": {
    "profile": "US_GAAP_SEC",
    "standard": "United States Generally Accepted Accounting Principles (US GAAP)",
    "presentation_standard": "US GAAP and SEC Regulation S-X Rule 5-03",
    "statement_type": "income_statement",
    "statement_scope": "consolidated",
    "jurisdiction": "United States",
    "monetary_unit": "USD",
    "amount_scale": "1",
    "operating_cash_flow_method": "not_applicable",
    "presentation_basis": "not_applicable",
    "expense_analysis": "function"
  },
  "source": {
    "statement": "Consolidated statements of income and comprehensive income",
    "basis": "Audited consolidated figures; source presented in USD millions and normalized to full USD",
    "report": "NVIDIA Fiscal 2025 Form 10-K",
    "url": "https://www.sec.gov/Archives/edgar/data/1045810/000104581025000023/nvda-20250126.htm",
    "page": "Form 10-K pp. 52-53, fiscal 2023 column",
    "taxonomy_element": "us-gaap:StatementOfIncomeAndComprehensiveIncome",
    "period_start": "2022-01-31",
    "period_end": "2023-01-29"
  },
  "operating": [
    {
      "canonical_field": "net_sales_of_tangible_products",
      "name": "Net sales of tangible products",
      "amount": "0",
      "source_field": "[not separately reported] Net sales of tangible products",
      "description": "This indicator represents net sales of tangible products. NVIDIA did not separately report this US_GAAP_SEC field for 2023; it is explicitly normalized to zero to keep the canonical field set complete.",
      "source_reference": "Form 10-K pp. 52-53, fiscal 2023 column",
      "is_deduction": false,
      "is_subtotal": false,
      "cash_flow_direction": "not_applicable",
      "is_non_cash": false
    },
    {
      "canonical_field": "operating_revenues",
      "name": "Operating revenues",
      "amount": "0",
      "source_field": "[not separately reported] Operating revenues",
      "description": "This indicator represents operating revenues. NVIDIA did not separately report this US_GAAP_SEC field for 2023; it is explicitly normalized to zero to keep the canonical field set complete.",
      "source_reference": "Form 10-K pp. 52-53, fiscal 2023 column",
      "is_deduction": false,
      "is_subtotal": false,
      "cash_flow_direction": "not_applicable",
      "is_non_cash": false
    },
    {
      "canonical_field": "rental_income",
      "name": "Rental income",
      "amount": "0",
      "source_field": "[not separately reported] Rental income",
      "description": "This indicator represents rental income. NVIDIA did not separately report this US_GAAP_SEC field for 2023; it is explicitly normalized to zero to keep the canonical field set complete.",
      "source_reference": "Form 10-K pp. 52-53, fiscal 2023 column",
      "is_deduction": false,
      "is_subtotal": false,
      "cash_flow_direction": "not_applicable",
      "is_non_cash": false
    },
    {
      "canonical_field": "service_revenues",
      "name": "Service revenues",
      "amount": "0",
      "source_field": "[not separately reported] Service revenues",
      "description": "This indicator represents service revenues. NVIDIA did not separately report this US_GAAP_SEC field for 2023; it is explicitly normalized to zero to keep the canonical field set complete.",
      "source_reference": "Form 10-K pp. 52-53, fiscal 2023 column",
      "is_deduction": false,
      "is_subtotal": false,
      "cash_flow_direction": "not_applicable",
      "is_non_cash": false
    },
    {
      "canonical_field": "other_revenues",
      "name": "Other revenues",
      "amount": "0",
      "source_field": "[not separately reported] Other revenues",
      "description": "This indicator represents other revenues. NVIDIA did not separately report this US_GAAP_SEC field for 2023; it is explicitly normalized to zero to keep the canonical field set complete.",
      "source_reference": "Form 10-K pp. 52-53, fiscal 2023 column",
      "is_deduction": false,
      "is_subtotal": false,
      "cash_flow_direction": "not_applicable",
      "is_non_cash": false
    },
    {
      "canonical_field": "net_sales_and_gross_revenues",
      "name": "Net sales and gross revenues",
      "amount": "26974000000",
      "source_field": "Revenue",
      "description": "This indicator represents net sales and gross revenues. NVIDIA filed 'Revenue' at 26974 USD millions in NVIDIA Fiscal 2025 Form 10-K; it is mapped to US_GAAP_SEC field 'net_sales_and_gross_revenues' and converted to full USD without adding precision.",
      "source_reference": "Form 10-K pp. 52-53, fiscal 2023 column",
      "is_deduction": false,
      "is_subtotal": false,
      "cash_flow_direction": "not_applicable",
      "is_non_cash": false
    },
    {
      "canonical_field": "cost_of_tangible_goods_sold",
      "name": "Cost of tangible goods sold",
      "amount": "0",
      "source_field": "[not separately reported] Cost of tangible goods sold",
      "description": "This indicator represents cost of tangible goods sold. NVIDIA did not separately report this US_GAAP_SEC field for 2023; it is explicitly normalized to zero to keep the canonical field set complete.",
      "source_reference": "Form 10-K pp. 52-53, fiscal 2023 column",
      "is_deduction": true,
      "is_subtotal": false,
      "cash_flow_direction": "not_applicable",
      "is_non_cash": false
    },
    {
      "canonical_field": "utility_operating_expenses",
      "name": "Utility operating expenses",
      "amount": "0",
      "source_field": "[not separately reported] Utility operating expenses",
      "description": "This indicator represents utility operating expenses. NVIDIA did not separately report this US_GAAP_SEC field for 2023; it is explicitly normalized to zero to keep the canonical field set complete.",
      "source_reference": "Form 10-K pp. 52-53, fiscal 2023 column",
      "is_deduction": true,
      "is_subtotal": false,
      "cash_flow_direction": "not_applicable",
      "is_non_cash": false
    },
    {
      "canonical_field": "expenses_applicable_to_rental_income",
      "name": "Expenses applicable to rental income",
      "amount": "0",
      "source_field": "[not separately reported] Expenses applicable to rental income",
      "description": "This indicator represents expenses applicable to rental income. NVIDIA did not separately report this US_GAAP_SEC field for 2023; it is explicitly normalized to zero to keep the canonical field set complete.",
      "source_reference": "Form 10-K pp. 52-53, fiscal 2023 column",
      "is_deduction": true,
      "is_subtotal": false,
      "cash_flow_direction": "not_applicable",
      "is_non_cash": false
    },
    {
      "canonical_field": "cost_of_services",
      "name": "Cost of services",
      "amount": "0",
      "source_field": "[not separately reported] Cost of services",
      "description": "This indicator represents cost of services. NVIDIA did not separately report this US_GAAP_SEC field for 2023; it is explicitly normalized to zero to keep the canonical field set complete.",
      "source_reference": "Form 10-K pp. 52-53, fiscal 2023 column",
      "is_deduction": true,
      "is_subtotal": false,
      "cash_flow_direction": "not_applicable",
      "is_non_cash": false
    },
    {
      "canonical_field": "expenses_applicable_to_other_revenues",
      "name": "Expenses applicable to other revenues",
      "amount": "0",
      "source_field": "[not separately reported] Expenses applicable to other revenues",
      "description": "This indicator represents expenses applicable to other revenues. NVIDIA did not separately report this US_GAAP_SEC field for 2023; it is explicitly normalized to zero to keep the canonical field set complete.",
      "source_reference": "Form 10-K pp. 52-53, fiscal 2023 column",
      "is_deduction": true,
      "is_subtotal": false,
      "cash_flow_direction": "not_applicable",
      "is_non_cash": false
    },
    {
      "canonical_field": "other_operating_costs_and_expenses",
      "name": "Other operating costs and expenses",
      "amount": "11618000000",
      "source_field": "Cost of revenue",
      "description": "This indicator represents other operating costs and expenses. NVIDIA filed 'Cost of revenue' at 11618 USD millions in NVIDIA Fiscal 2025 Form 10-K; it is mapped to US_GAAP_SEC field 'other_operating_costs_and_expenses' and converted to full USD without adding precision.",
      "source_reference": "Form 10-K pp. 52-53, fiscal 2023 column",
      "is_deduction": true,
      "is_subtotal": false,
      "cash_flow_direction": "not_applicable",
      "is_non_cash": false
    },
    {
      "canonical_field": "selling_general_and_administrative_expenses",
      "name": "Selling, general and administrative expenses",
      "amount": "2440000000",
      "source_field": "Sales, general and administrative",
      "description": "This indicator represents selling, general and administrative expenses. NVIDIA filed 'Sales, general and administrative' at 2440 USD millions in NVIDIA Fiscal 2025 Form 10-K; it is mapped to US_GAAP_SEC field 'selling_general_and_administrative_expenses' and converted to full USD without adding precision.",
      "source_reference": "Form 10-K pp. 52-53, fiscal 2023 column",
      "is_deduction": true,
      "is_subtotal": false,
      "cash_flow_direction": "not_applicable",
      "is_non_cash": false
    },
    {
      "canonical_field": "provision_for_credit_losses",
      "name": "Provision for credit losses",
      "amount": "0",
      "source_field": "[not separately reported] Provision for credit losses",
      "description": "This indicator represents provision for credit losses. NVIDIA did not separately report this US_GAAP_SEC field for 2023; it is explicitly normalized to zero to keep the canonical field set complete.",